{"$schema":"http://json-schema.org/draft-07/schema#","properties":{"budget":{"properties":{"max_retries":{"minimum":0,"type":"integer"},"max_steps":{"minimum":1,"type":"integer"}},"type":"object"},"constraints":{"items":{"type":"string"},"type":"array"},"context":{"type":"string"},"goal":{"type":"string"},"id":{"type":"string"},"success_criteria":{"items":{"properties":{"cmd":{"items":{"type":"string"},"type":"array"},"description":{"type":"string"},"expect_exit_code":{"type":"integer"},"expect_in_output":{"type":"string"},"id":{"type":"string"},"path":{"type":"string"},"type":{"enum":["file_exists","command"],"type":"string"}},"required":["id","description","type"],"type":"object"},"minItems":1,"type":"array"}},"required":["id","goal","success_criteria"],"title":"Cipher task","type":"object"}