{"budget":{"max_retries":2,"max_steps":30},"constraints":["Python 3 stdlib only","stay inside the repo sandbox","no network"],"context":"First live-LLM validation task for the Cipher prototype. Keep the solution small; correctness matters more than elegance.","goal":"Write a Python script at artifacts/fizzbuzz.py that prints the FizzBuzz sequence for numbers 1 through 20 (multiples of 3 -> 'Fizz', multiples of 5 -> 'Buzz', multiples of both -> 'FizzBuzz', otherwise the number), and provide a test proving it works.","id":"fizzbuzz-task","success_criteria":[{"description":"The fizzbuzz script exists at artifacts/fizzbuzz.py","id":"fizzbuzz-script-exists","path":"artifacts/fizzbuzz.py","type":"file_exists"},{"cmd":["python3","artifacts/fizzbuzz.py"],"description":"Running the script prints the FizzBuzz sequence for 1..20","expect_in_output":"FizzBuzz","id":"fizzbuzz-output","type":"command"},{"description":"A test file proving fizzbuzz works exists","id":"fizzbuzz-test-exists","path":"tests/test_fizzbuzz.py","type":"file_exists"}]}