{"budget":{"max_retries":2,"max_steps":30},"constraints":["Python 3 stdlib only","stay inside the repo sandbox","no network"],"context":"This is the smoke-test task for the Cipher prototype. The coordinator should spawn a test-writer specialist to author the test.","goal":"Write a Python script at artifacts/hello.py that prints 'Hello, Cipher!' and provide a test proving it works.","id":"example-hello-task","success_criteria":[{"description":"The hello script exists at artifacts/hello.py","id":"hello-script-exists","path":"artifacts/hello.py","type":"file_exists"},{"cmd":["python3","artifacts/hello.py"],"description":"Running the script prints 'Hello, Cipher!'","expect_in_output":"Hello, Cipher!","id":"hello-output","type":"command"},{"description":"A test file written by the spawned test-writer specialist exists","id":"hello-test-exists","path":"tests/test_hello_cipher.py","type":"file_exists"}]}